Authors,Link
"Zhang A., Wang Q., He Y., Lai P., Miu Y., Xiao Z.","https://www.scopus.com/inward/record.uri?eid=2-s2.0-85079744169&doi=10.1088%2f1757-899X%2f729%2f1%2f012048&partnerID=40&md5=fe1617e62097a485034c73ba181b37f5"
"Wang Z., Li Y., Song Y., Li J., Zhang Q.","https://www.scopus.com/inward/record.uri?eid=2-s2.0-85078515192&doi=10.3139%2f113.110657&partnerID=40&md5=85b617e00d8b1fba9ad2c728f13126fa"
"Tot A., Podlipnik Č., Bešter-Rogač M., Gadžurić S., Vraneš M.","https://www.scopus.com/inward/record.uri?eid=2-s2.0-85039558118&doi=10.1016%2fj.arabjc.2017.12.011&partnerID=40&md5=0e6fa3f78973a4c8d140513c028037b8"
"Zhou H., Chen L., Wei Z., Lu Y., Peng C., Zhang B., Zhao X., Wu L., Wang Y.","https://www.scopus.com/inward/record.uri?eid=2-s2.0-85071399625&doi=10.3390%2fmolecules24173112&partnerID=40&md5=763f9d98bd93bdbe25f3d9e2cef72078"
"Członka S., Strąkowska A., Strzelec K., Kairytė A., Vaitkus S.","https://www.scopus.com/inward/record.uri?eid=2-s2.0-85060606298&doi=10.1016%2fj.polymertesting.2019.01.021&partnerID=40&md5=fbb925d2aa8b11a02c27ac93f4537f9f"
"Tarasova N.P., Zanin A.A.","https://www.scopus.com/inward/record.uri?eid=2-s2.0-85061742078&doi=10.1515%2fpac-2018-0716&partnerID=40&md5=4254304358cf9601eb50829ffb71b7f9"
"Li S., Li S., Zhai Q., Jiang Y., Hu M.","https://www.scopus.com/inward/record.uri?eid=2-s2.0-85055039016&doi=10.1016%2fj.molliq.2018.10.014&partnerID=40&md5=2a572a56b01fe809e37a0f3ee71ad8a2"
"Pickford T., Gu X., Heeley E.L., Wan C.","https://www.scopus.com/inward/record.uri?eid=2-s2.0-85072318262&doi=10.1039%2fc9ce01051c&partnerID=40&md5=883cf644d06e1f5c75190c3022e152cc"
"Dias A.R., Costa-Rodrigues J., Teixeira C., Prudêncio C., Gomes P., Ferraz R.","https://www.scopus.com/inward/record.uri?eid=2-s2.0-85063353936&doi=10.2174%2f0929867325666181026110227&partnerID=40&md5=84682b4e1ffbb133738c637d30442529"
"Sahrash R., Siddiqa A., Razzaq H., Iqbal T., Qaisar S.","https://www.scopus.com/inward/record.uri?eid=2-s2.0-85056180405&doi=10.1016%2fj.heliyon.2018.e00847&partnerID=40&md5=dc24bf55ebda6cfc8db6235379085c89"
"Chen S., Zhou B., Ma M., Shi Y., Wang X.","https://www.scopus.com/inward/record.uri?eid=2-s2.0-85044273121&doi=10.1002%2fpat.4285&partnerID=40&md5=1452c7be6fa26a9afdcbffa7141abf86"
"Domańska U., Wlazło M., Paduszyński K.","https://www.scopus.com/inward/record.uri?eid=2-s2.0-85020455917&doi=10.1016%2fj.seppur.2017.05.056&partnerID=40&md5=6b088bd6e1b5ee09c8afc73bfa10a1e8"
"Zhao H., Afriyie L.O., Larm N.E., Baker G.A.","https://www.scopus.com/inward/record.uri?eid=2-s2.0-85056116320&doi=10.1039%2fc8ra07733a&partnerID=40&md5=4f34e7647ea0c97a55b064580c20ffaf"
"Xing C.Y., Li Y.J.","https://www.scopus.com/inward/record.uri?eid=2-s2.0-85030789508&doi=10.1039%2f9781788010535-00280&partnerID=40&md5=2bad2fc0f5196912239ca5625635f660"
"Wang Y., Xing C., Guan J., Li Y.","https://www.scopus.com/inward/record.uri?eid=2-s2.0-85033375621&doi=10.3390%2fpolym9110562&partnerID=40&md5=96a843feeb092214f2fad905d458ea68"
"Rinkenburger A., Toriyama T., Yasuda K., Niessner R.","https://www.scopus.com/inward/record.uri?eid=2-s2.0-85020454219&doi=10.1002%2fcctc.201700338&partnerID=40&md5=06a5baeb07ab5b5c91de47a4eab8c54a"
"Jankowska E., Lota G., Pernak J., Rzeszutek W., Majchrzycki W., Blazejczak M., Baraniak M.","https://www.scopus.com/inward/record.uri?eid=2-s2.0-85032438389&partnerID=40&md5=35a912611353d469fa877880599e5756"
"Popa G.A., Popa D.F., Slave D.D., Spiridon I.D., Mirea C.M., Ciocanea A.","https://www.scopus.com/inward/record.uri?eid=2-s2.0-85019468342&partnerID=40&md5=a9b6557c3d225127b00777acd188fb62"
"Al Ani H.N.A., Cimbru A.M., Trisca-Rusu C., Tanczos S.K., Cuciureanu A., Nechifor A.C.","https://www.scopus.com/inward/record.uri?eid=2-s2.0-85038831508&partnerID=40&md5=573754247aeaa5299cb36b6ca0741537"
"Depuydt D., Van Den Bossche A., Dehaen W., Binnemans K.","https://www.scopus.com/inward/record.uri?eid=2-s2.0-85021630251&doi=10.1039%2fc7cc01685a&partnerID=40&md5=7234296cddf05ad45aeded846c7bc30c"
"Srihata W., Jamnongkan T., Rattanasak U., Boonsang S., Kaewpirom S.","https://www.scopus.com/inward/record.uri?eid=2-s2.0-84983750774&doi=10.1007%2fs10854-016-5620-0&partnerID=40&md5=bbbba793882f07250053114c48a5d7cd"
"Pandey A., Ekka M.K., Ranjan S., Maiti S., Sachidanandan C.","https://www.scopus.com/inward/record.uri?eid=2-s2.0-85021631826&doi=10.1039%2fc7ra01520h&partnerID=40&md5=1632562f107ecae9f2a1420bf7a13805"
"Khan I., Usmani M.A., Bhat A.H., Rather J.A., Hassan S.I., Mumam A.","https://www.scopus.com/inward/record.uri?eid=2-s2.0-85038555414&doi=10.1007%2f978-3-319-46610-1_5&partnerID=40&md5=06448c71407d29f6ba34dea2f9ccf16e"
"Feder-Kubis J., Musiał M., Dzida M., Geppert-Rybczyńska M.","https://www.scopus.com/inward/record.uri?eid=2-s2.0-84991515549&doi=10.1016%2fj.jiec.2016.07.003&partnerID=40&md5=03af907583769fb121b3f0e26bba4423"
"Pionteck J., Wypych G.","https://www.scopus.com/inward/record.uri?eid=2-s2.0-85010534847&partnerID=40&md5=c34465949a8dc8cb5c39a3c159f0b5f4"
"El-meniawi M.A.H., Mahmoud K.R., Megahed M.","https://www.scopus.com/inward/record.uri?eid=2-s2.0-84981710046&doi=10.1007%2fs10965-016-1074-6&partnerID=40&md5=f6243e0a9e10b657b6833e757535ba58"
"Liu B., Jina N.","https://www.scopus.com/inward/record.uri?eid=2-s2.0-84981495310&doi=10.2174%2f1385272820666160527101844&partnerID=40&md5=dff9fbc28d7bd4df744a60446c61c5f6"
"Sun Y., Wang C., Wang W., Yang X., Di Serio M., Zhi L.","https://www.scopus.com/inward/record.uri?eid=2-s2.0-84962863867&doi=10.1007%2fs11743-016-1801-3&partnerID=40&md5=58d2fa4b3b9a7b70274255ee673f804a"
"Phua J.-L., Teh P.-L., Ghani S.A., Yeoh C.-K.","https://www.scopus.com/inward/record.uri?eid=2-s2.0-84969746080&doi=10.1515%2fpolyeng-2015-0026&partnerID=40&md5=8566cf17d34cbe1e166dce6d8367ebb2"
"El Hasnaoui M., Abazine K., Achour M.E., Costa L.C.","https://www.scopus.com/inward/record.uri?eid=2-s2.0-84979753517&partnerID=40&md5=a62b5098c8261b7d7e85940913063334"
"Xing C., Wang Y., Huang X., Li Y., Li J.","https://www.scopus.com/inward/record.uri?eid=2-s2.0-84958020044&doi=10.1021%2facs.macromol.5b02429&partnerID=40&md5=86d2b839a2b01fe46686bdab46897ceb"
"Zhang Y., Li Y., Song Y., Li J.","https://www.scopus.com/inward/record.uri?eid=2-s2.0-84956680910&doi=10.1007%2fs00396-015-3771-9&partnerID=40&md5=0951cf7e16d771a3f79893c6a135209e"
"Saji J., Khare A., Mahapatra S.P.","https://www.scopus.com/inward/record.uri?eid=2-s2.0-84954308125&doi=10.1177%2f0954008314568729&partnerID=40&md5=59f49790e4bd8747ca143a8c4f739f4b"
"Kopczyński K., Baraniak M., Pernak J., Giszter R., Fryder M., Lota G.","https://www.scopus.com/inward/record.uri?eid=2-s2.0-84992396646&partnerID=40&md5=000a6090edf7ec4be33a84d738eccaee"
"Lota G., Baraniak M., Kopczynski K., Pernak J., Przybylo H., Majchrzycki W.","https://www.scopus.com/inward/record.uri?eid=2-s2.0-84992388334&partnerID=40&md5=46aca6d028a8eb3c2210b2c1d18d973a"
"Seki Y., Yıldız N., İnce M., Şengül S., Sever K., Sarıkanat M., Dikici T.","https://www.scopus.com/inward/record.uri?eid=2-s2.0-84981165837&doi=10.1080%2f14658011.2016.1201258&partnerID=40&md5=cf0ab59877b7b5ce5dba2aca48ea450b"
[No author name available],"https://www.scopus.com/inward/record.uri?eid=2-s2.0-84991396761&doi=10.1149%2f07515.0215ecst&partnerID=40&md5=02bdca8fff8bd06f7e8f5d3cb6e67361"
"Fetouhi B., Belarbi H., Benabdellah A., Kasmi-Mir S., Kirsch G.","https://www.scopus.com/inward/record.uri?eid=2-s2.0-84959497975&partnerID=40&md5=55ac48e7fe34e5097108923d0bbf6bde"
"Depuydt D., Van Den Bossche A., Dehaen W., Binnemans K.","https://www.scopus.com/inward/record.uri?eid=2-s2.0-84957043765&doi=10.1039%2fc5ra22798d&partnerID=40&md5=f785276ea2c064bece5ab01c0649a863"
"Ismail A.M., Mahmoud K.R., Abd-El Salam M.H.","https://www.scopus.com/inward/record.uri?eid=2-s2.0-84942420735&doi=10.1016%2fj.polymertesting.2015.09.006&partnerID=40&md5=a87d29688a1b21bdf08499f1f817d51e"
"Li F., Zhang Q., Pan D., Lin M., Kang Q.","https://www.scopus.com/inward/record.uri?eid=2-s2.0-84929839263&doi=10.1007%2fs11581-014-1312-z&partnerID=40&md5=09ec7e50851ec8d0950daf77bf15b049"
"Xing C., Wang Y., Zhang C., Li L., Li Y., Li J.","https://www.scopus.com/inward/record.uri?eid=2-s2.0-84942931555&doi=10.1021%2facs.iecr.5b02819&partnerID=40&md5=e028cfd6071b6cebe087e2f652fb59eb"
"Xing C., You J., Li Y., Li J.","https://www.scopus.com/inward/record.uri?eid=2-s2.0-84941249158&doi=10.1021%2facs.jpcc.5b05349&partnerID=40&md5=4077c3c2e6b5c1de24088809f06a3a63"
"Zieliński W., Wilk K.A., Para G., Jarek E., Ciszewski K., Palus J., Warszyński P.","https://www.scopus.com/inward/record.uri?eid=2-s2.0-84939417875&doi=10.1016%2fj.colsurfa.2015.01.050&partnerID=40&md5=44e3925cb83f339bbf92b26656391f59"
"Pendleton J.N., Gilmore B.F.","https://www.scopus.com/inward/record.uri?eid=2-s2.0-84937632816&doi=10.1016%2fj.ijantimicag.2015.02.016&partnerID=40&md5=062c7b24754228e560f013ec0e667036"
"Kundu K., Paul B.K., Bardhan S., Saha S.K.","https://www.scopus.com/inward/record.uri?eid=2-s2.0-84955401752&doi=10.1002%2f9781118854501.ch20&partnerID=40&md5=e74fe91a146a2b4e38217b9e835f1f42"
"Bashir T., Shakoor A., Ahmad E., Saeed M., Niaz N.A., Tirmizi S.K.","https://www.scopus.com/inward/record.uri?eid=2-s2.0-84935902433&doi=10.1134%2fS1560090415030021&partnerID=40&md5=9ac29351617d191b1003904436907988"
"Pawlak K., Szurkowski J., Skrzypczak A., Bialek-Bylka G.E.","https://www.scopus.com/inward/record.uri?eid=2-s2.0-84925703284&doi=10.1007%2fs10973-014-4185-5&partnerID=40&md5=b66e572ac543e9e2c89027e703611dbe"
"Xing C., Guan J., Chen Z., Zhu Y., Zhang B., Li Y., Li J.","https://www.scopus.com/inward/record.uri?eid=2-s2.0-84923884574&doi=10.1088%2f0957-4484%2f26%2f10%2f105704&partnerID=40&md5=f768caaa1ae34975597142ae71cb667a"
"Mutelet F., Carré P., Skrzypczak A.","https://www.scopus.com/inward/record.uri?eid=2-s2.0-84916899225&doi=10.1016%2fj.fluid.2014.11.020&partnerID=40&md5=aca2b9a9ff4b5d90c2c50cb147a51815"
"Saini P., Choudhary V.","https://www.scopus.com/inward/record.uri?eid=2-s2.0-84928898544&partnerID=40&md5=7117521a3269a32b7d8d48d7ef376343"
"Valderrama J.O., Faúndez C.A., Vicencio V.J.","https://www.scopus.com/inward/record.uri?eid=2-s2.0-84903488906&doi=10.1021%2fie5010459&partnerID=40&md5=9199dff667a90d81e7a40fedbaab0ea3"
"Hijosa-Valsero M., Molina R., Bayona J.M.","https://www.scopus.com/inward/record.uri?eid=2-s2.0-84894264936&doi=10.1080%2f09593330.2013.869624&partnerID=40&md5=36a4b17f7ed32172d373f8a378a3056a"
"Xing C., Guan J., Li Y., Li J.","https://www.scopus.com/inward/record.uri?eid=2-s2.0-84896912094&doi=10.1021%2fam500061v&partnerID=40&md5=3fd5f7de362129e7efe24bd9a13a7068"
"Xing C., Zheng X., Xu L., Jia J., Ren J., Li Y.","https://www.scopus.com/inward/record.uri?eid=2-s2.0-84896517253&doi=10.1021%2fie404096b&partnerID=40&md5=ad75ae107859e0b4fb14f4f08af37f45"
"Roessler A., Schottenberger H.","https://www.scopus.com/inward/record.uri?eid=2-s2.0-84894901562&doi=10.1016%2fj.porgcoat.2013.11.022&partnerID=40&md5=d4cc82eb26d208845204b5426c46557f"
"Saini P., Arora M., Arya S.K., Tawale J.S.","https://www.scopus.com/inward/record.uri?eid=2-s2.0-84897757653&partnerID=40&md5=b9f175eaa5ccf74f091335331452ba63"
"Jacquemin J., Feder-Kubis J., Zorȩbski M., Grzybowska K., Chora̧zewski M., Hensel-Bielówka S., Zorȩbski E., Paluch M., Dzida M.","https://www.scopus.com/inward/record.uri?eid=2-s2.0-84893507923&doi=10.1039%2fc3cp54533d&partnerID=40&md5=5ff6e6193a5d204bb519098c3e7d66f8"
"Valderrama J.O.","https://www.scopus.com/inward/record.uri?eid=2-s2.0-84892707474&doi=10.1021%2fie403293z&partnerID=40&md5=efa76da65a5e6a86409bab2ce3ba7521"
"Li S.J., Bai S.Y.","https://www.scopus.com/inward/record.uri?eid=2-s2.0-84896896798&doi=10.4028%2fwww.scientific.net%2fAMM.528.181&partnerID=40&md5=0d4e96d36da77b10bede854798b5c443"
"Yaman K., Çoǧun C.","https://www.scopus.com/inward/record.uri?eid=2-s2.0-84903304040&doi=10.1007%2fs00170-014-5839-y&partnerID=40&md5=0a3b9ae9655fd01feb8105b17fabc6b0"
"Laskowska A., Marzec A., Boiteux G., Zaborski M., Gain O., Serghei A.","https://www.scopus.com/inward/record.uri?eid=2-s2.0-84904677922&doi=10.1002%2fmasy.201300150&partnerID=40&md5=78a8509e3e41dfb1d174a3f8c8393c5d"
"Faisal M., Khasim S.","https://www.scopus.com/inward/record.uri?eid=2-s2.0-84901339669&doi=10.1134%2fS0965545X14030055&partnerID=40&md5=a69787f7e0ce4af132e39eb67eb0b0f2"
"El Hasnaoui M., Triki A., Achour M.E., Arous M.","https://www.scopus.com/inward/record.uri?eid=2-s2.0-84887056017&doi=10.1016%2fj.physb.2013.10.009&partnerID=40&md5=dadb6ab11770a81354a08f946bf10db4"
"Marzec A., Laskowska A., Boiteux G., Zaborski M., Gain O., Serghei A.","https://www.scopus.com/inward/record.uri?eid=2-s2.0-84906716159&doi=10.1002%2fmasy.201300231&partnerID=40&md5=383f8de5c1493dbb2c2eb8e010553873"
"Zhang J., Fang S., Qu L., Jin Y., Yang L., Hirano S.-I.","https://www.scopus.com/inward/record.uri?eid=2-s2.0-84908569714&doi=10.1021%2fie502716p&partnerID=40&md5=6f597d1eabab25b4c46d0ce4dc457467"
"Hijosa-Valsero M., Molina R., Montràs A., Müller M., Bayona J.M.","https://www.scopus.com/inward/record.uri?eid=2-s2.0-84930614320&doi=10.1080%2f21622515.2014.990935&partnerID=40&md5=db0917ce34fda25d6d22b0a00627cc5e"
"Zhang M., Liang X., Jiang S., Qiu H.","https://www.scopus.com/inward/record.uri?eid=2-s2.0-84888272098&doi=10.1016%2fj.trac.2013.09.011&partnerID=40&md5=0c016208c583ffdc05a0669c08e11c9d"
"Pang H., Xu L., Yan D.-X., Li Z.-M.","https://www.scopus.com/inward/record.uri?eid=2-s2.0-84908368327&doi=10.1016%2fj.progpolymsci.2014.07.007&partnerID=40&md5=72d511a15d107b062a0d573e84bcd368"
"Bao L., Lei J., Wang J.","https://www.scopus.com/inward/record.uri?eid=2-s2.0-84885783044&doi=10.1016%2fj.elstat.2013.09.001&partnerID=40&md5=2fa4b7dc0228eea8238fda63707437ba"
"Takaki K.","https://www.scopus.com/inward/record.uri?eid=2-s2.0-84892077547&partnerID=40&md5=676b203d4e42d0d146f04b8d51efc841"
"Hijosa-Valsero M., Molina R., Schikora H., Müller M., Bayona J.M.","https://www.scopus.com/inward/record.uri?eid=2-s2.0-84885340384&doi=10.1016%2fj.jhazmat.2013.09.022&partnerID=40&md5=2c3922c59eb2d4c1825a5a34a8a25d03"
"Arora M., Saini P.","https://www.scopus.com/inward/record.uri?eid=2-s2.0-84887854464&partnerID=40&md5=d5f5f2b09a8a37428398315940a04ed3"
"Laskowska A., Marzec A., Boiteux G., Zaborski M., Gain O., Serghei A.","https://www.scopus.com/inward/record.uri?eid=2-s2.0-84885399481&doi=10.1002%2fpi.4550&partnerID=40&md5=72c694ac6be6cd39834a4f2b682ce9d5"
"Tavanaie M.A.","https://www.scopus.com/inward/record.uri?eid=2-s2.0-84886257029&doi=10.1002%2fceat.201300146&partnerID=40&md5=a49a55b0ae67e5f4f18e2d75deacf5c0"
"Guo L.Y., Bai S.Y., Liu J.L., Ma Q.P.","https://www.scopus.com/inward/record.uri?eid=2-s2.0-84886284587&doi=10.4028%2fwww.scientific.net%2fAMR.798-799.211&partnerID=40&md5=2cf803201a0448f619489ebe119fb611"
"Markiewicz B., Łȩgosz B., Kordala-Markiewicz R., Walkiewicz F., Gwiazdowski R., Kubiak K., Praczyk T.","https://www.scopus.com/inward/record.uri?eid=2-s2.0-84885408287&partnerID=40&md5=3ac6c39b24dce118f530523768e2265c"
"Niemczak M., Walkiewicz F., Giszter R.","https://www.scopus.com/inward/record.uri?eid=2-s2.0-84885416803&partnerID=40&md5=513922395ae9d2e9d5720925cb190f0a"
"Macaev F.Z.","https://www.scopus.com/inward/record.uri?eid=2-s2.0-84883429000&doi=10.1007%2f978-94-007-6461-3_25&partnerID=40&md5=28b7f14571ebe2efd375fa0b24d45286"
"Pawlak K., Skrzypczak A., Bialek-Bylka G.E.","https://www.scopus.com/inward/record.uri?eid=2-s2.0-84878324619&doi=10.1016%2fj.dyepig.2013.04.033&partnerID=40&md5=dc79d385b22d73a983a5f7c06013dead"
"Tarasova N.P., Smetannikov Y.V., Zanin A.A.","https://www.scopus.com/inward/record.uri?eid=2-s2.0-84877782362&doi=10.1134%2fS0012500813040010&partnerID=40&md5=40c8eea38bc09858aa5b7c1486f33737"
"Wei Y.-F., Li Z.-Q.","https://www.scopus.com/inward/record.uri?eid=2-s2.0-84876138061&doi=10.1063%2f1.4800568&partnerID=40&md5=35f1643ebbef8d0fb5a55560a79872db"
"Hijosa-Valsero M., Molina R., Schikora H., Müller M., Bayona J.M.","https://www.scopus.com/inward/record.uri?eid=2-s2.0-84873522474&doi=10.1016%2fj.watres.2013.01.001&partnerID=40&md5=27858d1d259403f66a5e972aa9204dda"
"Valderrama J.O., Arce P.F.","https://www.scopus.com/inward/record.uri?eid=2-s2.0-84872393107&doi=10.1016%2fj.fluid.2012.12.012&partnerID=40&md5=42a2f08e12c691996abb27b5bc4eb83e"
"Zhang J.","https://www.scopus.com/inward/record.uri?eid=2-s2.0-84873371021&doi=10.4028%2fwww.scientific.net%2fAMM.275-277.2182&partnerID=40&md5=9ed5d6b85b0fcdd0692b2ebcb601f0d6"
"Xu Y.","https://www.scopus.com/inward/record.uri?eid=2-s2.0-84873859584&doi=10.4028%2fwww.scientific.net%2fAMR.641-642.890&partnerID=40&md5=d49381303f62745bd0a33ef48f1d7d8a"
"Yuan Q., Bateman S.A., Shen S., Gloria-Esparza C., Xia K.","https://www.scopus.com/inward/record.uri?eid=2-s2.0-84872375159&doi=10.1177%2f0892705711417656&partnerID=40&md5=17cbc16c702a27cfabc276d9b7a9f7bc"
"Bi W., Tian M., Row K.H.","https://www.scopus.com/inward/record.uri?eid=2-s2.0-84873188992&doi=10.1080%2f00032719.2012.721106&partnerID=40&md5=42d599e4327a8f054e6c11c4b64949dc"
"Das R.N., Roy K.","https://www.scopus.com/inward/record.uri?eid=2-s2.0-84873407451&doi=10.1007%2fs11030-012-9413-y&partnerID=40&md5=e6ce8db2cb41ca27282b2280ddb113f0"
"Xu X., Xiao H., Guan Y., Li S., Wei D., Zheng A.","https://www.scopus.com/inward/record.uri?eid=2-s2.0-84867575100&doi=10.1002%2fapp.37524&partnerID=40&md5=70dc1be7cb54c60d2e2016d96b7f687c"
"Pietrzak R., Szatanik R., Olchawa R., Książek K.","https://www.scopus.com/inward/record.uri?eid=2-s2.0-84881555919&doi=10.1007%2fs11003-013-9561-y&partnerID=40&md5=647056b3a9e44f49ca065123d02a6286"
"Tian M., Bi W., Row K.H.","https://www.scopus.com/inward/record.uri?eid=2-s2.0-84870914783&doi=10.1002%2fpca.2386&partnerID=40&md5=88975e357a6ca2bd7e02e48bf898b424"
"Saini P., Choudhary V.","https://www.scopus.com/inward/record.uri?eid=2-s2.0-84871607283&doi=10.1007%2fs10853-012-6797-0&partnerID=40&md5=1049791dece10dd577a5665de9d3e6a2"
"Xing C., Zhao M., Zhao L., You J., Cao X., Li Y.","https://www.scopus.com/inward/record.uri?eid=2-s2.0-84887579702&doi=10.1039%2fc3py00466j&partnerID=40&md5=a4e1104f4a05eec343a87f0c7a80d859"
"Zhao C., Xue J., Ran F., Sun S.","https://www.scopus.com/inward/record.uri?eid=2-s2.0-84866151570&doi=10.1016%2fj.pmatsci.2012.07.002&partnerID=40&md5=00fed3547644cbda71485e67809cf5f5"
"Zu L., Zhang X., Wang Y., Xue S., Xu D., Zhang X.","https://www.scopus.com/inward/record.uri?eid=2-s2.0-84872476959&partnerID=40&md5=e5566f21d434bb6c21c1fc8244698a61"
"Bilinska A., Žilinskas A.","https://www.scopus.com/inward/record.uri?eid=2-s2.0-84875200988&partnerID=40&md5=07b8969033b767e885851bc43f391d38"
"Agrisuelas J., García-Jareño J.J., Piedras M., Sanz C., Vicente F.","https://www.scopus.com/inward/record.uri?eid=2-s2.0-84885740149&doi=10.1149%2f05050.0071ecst&partnerID=40&md5=788e3947df9a22128f9bbd68ae57248f"
"Bunio P., Chlebicki J.","https://www.scopus.com/inward/record.uri?eid=2-s2.0-84867099649&doi=10.1016%2fj.colsurfa.2012.03.060&partnerID=40&md5=1f026ea4cf9131851a680f7d58f3afff"
"Pietka-Ottlik M., Frackowiak R., Maliszewska I., Kołwzan B., Wilk K.A.","https://www.scopus.com/inward/record.uri?eid=2-s2.0-84865727756&doi=10.1016%2fj.chemosphere.2012.05.090&partnerID=40&md5=7a2c9d556eb1850110d2adeeda35d197"
"Xu X., Xiao H., Guan Y., Li S., Wei D., Zheng A.","https://www.scopus.com/inward/record.uri?eid=2-s2.0-84863825034&doi=10.1002%2fapp.36620&partnerID=40&md5=e876c9f1db8a64d76941fb4db2c23999"
"Tong F.-F., Xu H., Yu J., Wen L.-X., Zhang J., He J.-S.","https://www.scopus.com/inward/record.uri?eid=2-s2.0-84867529977&doi=10.1021%2fie301409h&partnerID=40&md5=86ce3a798601aae5fe4504cb9fbace60"
"Bao Y., Li Q., Li Y., Fang J., Wu C.","https://www.scopus.com/inward/record.uri?eid=2-s2.0-84868358609&partnerID=40&md5=65c154af4e7ec91d63da1c9846d5ae24"
"Zheng A., Xu X., Xiao H., Li N., Guan Y., Li S.","https://www.scopus.com/inward/record.uri?eid=2-s2.0-84863527998&doi=10.1016%2fj.apsusc.2012.05.105&partnerID=40&md5=dc51c490d7afe84d7b2930acb3837cf0"
"Pernak J., Wasiński K., Praczyk T., Nawrot J., Cieniecka-Rosłonkiewicz A., Walkiewicz F., Materna K.","https://www.scopus.com/inward/record.uri?eid=2-s2.0-84866168631&doi=10.1007%2fs11426-012-4631-9&partnerID=40&md5=adad307dfb0956104dd59a498fd9f628"
"Valderrama J.O., Rojas R.E.","https://www.scopus.com/inward/record.uri?eid=2-s2.0-84864618336&doi=10.1016%2fj.crci.2012.04.011&partnerID=40&md5=4e7d6cd7c6b288b8873bd8fb263add6d"
"Domańska U., Pobudkowska A., Bocheńska P.","https://www.scopus.com/inward/record.uri?eid=2-s2.0-84863834619&doi=10.1021%2fje201301b&partnerID=40&md5=1e9be682d5109f44ffe6f65e278b3029"
"Choudalakis G., Gotsis A.D.","https://www.scopus.com/inward/record.uri?eid=2-s2.0-84859939168&doi=10.1016%2fj.cocis.2012.01.004&partnerID=40&md5=6d609551e68dad82cece988c2f51f4c0"
"El Hasnaoui M., Belattar J., Achour M.E., Costa L.C., Lahjomri F.","https://www.scopus.com/inward/record.uri?eid=2-s2.0-84863797746&partnerID=40&md5=41ebc6054c854bf7b5ab41fef6739941"
"Tang S., Baker G.A., Zhao H.","https://www.scopus.com/inward/record.uri?eid=2-s2.0-84860456856&doi=10.1039%2fc2cs15362a&partnerID=40&md5=1d92cc339389244df2fec1165efd7952"
"Song S., Fu P., Wang Y., Wang Z., Qian Y.","https://www.scopus.com/inward/record.uri?eid=2-s2.0-84862801215&doi=10.1016%2fj.colsurfa.2012.02.042&partnerID=40&md5=d1bb984730e55698edf9d1bd2c713376"
"Sharma P., Choi S.-H., Park S.-D., Baek I.-H., Lee G.-S.","https://www.scopus.com/inward/record.uri?eid=2-s2.0-84856328066&doi=10.1016%2fj.cej.2011.12.024&partnerID=40&md5=52e12cd95d65a29eb324e25fb85aa0b0"
"Yu W., Zhou X., Zhang W., Liu D., Liu D., Liu D.","https://www.scopus.com/inward/record.uri?eid=2-s2.0-84255188353&doi=10.4028%2fwww.scientific.net%2fAMR.415-417.728&partnerID=40&md5=3764f179954c62b49f2d56ea358f046d"
"Bi W., Zhu T., Park D.W., Row K.H.","https://www.scopus.com/inward/record.uri?eid=2-s2.0-84856901888&doi=10.1002%2fapj.495&partnerID=40&md5=8fe64c1d830ce6b104292e9d574aa0bc"
"Sirshendu De S., Mondal S.","https://www.scopus.com/inward/record.uri?eid=2-s2.0-85045347252&doi=10.1201%2fb12148&partnerID=40&md5=6d49b7325819a248a0242fc4657bc4ce"
"Bart J.C.J., Gucciardi E., Cavallaro S.","https://www.scopus.com/inward/record.uri?eid=2-s2.0-84902759438&doi=10.1533%2f9780857096326&partnerID=40&md5=c63eb57ab450c239d0ceaa486bddd456"
"Eisazadeh H., Tanzifi M.","https://www.scopus.com/inward/record.uri?eid=2-s2.0-80053378434&partnerID=40&md5=821407d3812e1a6aa28c9a52d0644a90"
"Saatchi M.M., Shojaei A.","https://www.scopus.com/inward/record.uri?eid=2-s2.0-79960634401&doi=10.1016%2fj.msea.2011.05.089&partnerID=40&md5=5ab089d3d8767557fc617f2f23515f8b"
"Jenkins H.D.B.","https://www.scopus.com/inward/record.uri?eid=2-s2.0-80053161769&doi=10.3184%2f003685011X13138407794135&partnerID=40&md5=023a279681f14bc7399451bb645b1ad1"
"Moniruzzaman M., Goto M.","https://www.scopus.com/inward/record.uri?eid=2-s2.0-79959724814&doi=10.1252%2fjcej.11we015&partnerID=40&md5=70f038ab32a03bb5657f270f84e99019"
"Verdolotti L., Colini S., Porta G., Iannace S.","https://www.scopus.com/inward/record.uri?eid=2-s2.0-79955881204&doi=10.1002%2fpen.21846&partnerID=40&md5=2f23613485e24918714b3fca7dfbfd6b"
"Alcantara G.B., Paterno L.G., Fonseca F.J., Morais P.C., Soler M.A.G.","https://www.scopus.com/inward/record.uri?eid=2-s2.0-79952183411&doi=10.1016%2fj.jmmm.2010.11.049&partnerID=40&md5=a461dd96ad87fdcb563206125f30e64c"
"Zhou H., Chen J., Ye L., Lin H., Yuan Y.","https://www.scopus.com/inward/record.uri?eid=2-s2.0-79955006034&doi=10.1016%2fj.biortech.2011.02.066&partnerID=40&md5=91b8ecdf4b75441ee81387d9654c11a9"
"Chutia A., Sahnoun R., Deka R.C., Zhu Z., Tsuboi H., Takaba H., Miyamoto A.","https://www.scopus.com/inward/record.uri?eid=2-s2.0-79953684856&doi=10.1016%2fj.physb.2011.01.012&partnerID=40&md5=0259b916fb08bd31ff8a2f10470c8630"
"Qian H., Liu D., Lv C.","https://www.scopus.com/inward/record.uri?eid=2-s2.0-79953300728&doi=10.2174%2f157017811795038386&partnerID=40&md5=9b27a3dbc18d62554da7a4f2ef4a2da5"
"Wang J., Che R., Yang W., Lei J.","https://www.scopus.com/inward/record.uri?eid=2-s2.0-79751482905&doi=10.1002%2fpi.2952&partnerID=40&md5=553b7b7127c1a9beb181abbfd16a4f0f"
"Petro R., Schlesinger M., Song G.-L.","https://www.scopus.com/inward/record.uri?eid=2-s2.0-84885701437&doi=10.1002%2f9780470602638.ch30&partnerID=40&md5=4948e0e9b0cfef7ccc33f0abafed0858"
"Shih Y.-H., Singco B., Liu W.-L., Hsu C.-H., Huang H.-Y.","https://www.scopus.com/inward/record.uri?eid=2-s2.0-79751495488&doi=10.1039%2fc0gc00803f&partnerID=40&md5=ac7418c95407eb3dfacf078b188109a3"
"Hua Q., Dabin L., Chunxu L.","https://www.scopus.com/inward/record.uri?eid=2-s2.0-79956372362&doi=10.1016%2fj.ultsonch.2010.12.009&partnerID=40&md5=b64e57303dd93c2171767e21a909526a"
"Feder-Kubis J.","https://www.scopus.com/inward/record.uri?eid=2-s2.0-78650473361&partnerID=40&md5=089e7ee26b9b1e7fcafa7cf15072733c"
"Dryzek E., Cholewa-Kowalska K., Pamuła E.","https://www.scopus.com/inward/record.uri?eid=2-s2.0-79960878603&partnerID=40&md5=648a4de95da7d6c5c8765b2f467ebee8"
"Wen B., Cheng D., Zheng M., Ling C.","https://www.scopus.com/inward/record.uri?eid=2-s2.0-78651366310&partnerID=40&md5=efb6af0e1fa4ac6b6bb25eed2e84f36e"
"Fojutowski A., Noskowiak A., Kot M., Kropacz A., Stangierska A.","https://www.scopus.com/inward/record.uri?eid=2-s2.0-78651485903&partnerID=40&md5=b244a1148c7ec98c0174910a236ada73"
"Moniruzzaman M., Kamiya N., Goto M.","https://www.scopus.com/inward/record.uri?eid=2-s2.0-77956916377&doi=10.1016%2fj.jcis.2010.08.035&partnerID=40&md5=8191fa7364eae1b2b451b8b1a4646101"
"Feder-Kubis J., Kubicki M., Pernak J.","https://www.scopus.com/inward/record.uri?eid=2-s2.0-78649883131&doi=10.1016%2fj.tetasy.2010.10.029&partnerID=40&md5=1663ebbe97f12e9d59affd531febb02e"
"Xue P., Bao Y., Li Q., Wu C.","https://www.scopus.com/inward/record.uri?eid=2-s2.0-77956510666&doi=10.1039%2fb924178g&partnerID=40&md5=b41633e8026ebbff756d5f62a61aea7e"
